<?xml version="1.0" encoding="UTF-8"?>

<!DOCTYPE cataleg SYSTEM "cataleg.dtd">

<cataleg>
    <single codi="S001">
        <titol>Flowers</titol>
        <descripcio>Single de gran èxit mundial</descripcio>
        <pais>USA</pais>
        <idioma>Anglès</idioma>
        <genere><Pop/></genere>
        <grup>Miley Cyrus</grup>
        <membres>
            <membre sexe="dona">
                <nom>Miley Cyrus</nom>
            </membre>
        </membres>
        <durada>3:20</durada>
    </single>

    <album codi="A001">
        <titol>Kind of Blue</titol>
        <pais>USA</pais>
        <idioma>Instrumental</idioma>
        <genere><Jazz/></genere>
        <grup>Miles Davis Sextet</grup>
        <membres>
            <membre sexe="home">
                <nom>Miles Davis</nom>
            </membre>
            <membre sexe="home">
                <nom>John Coltrane</nom>
            </membre>
        </membres>
        <numero_cançons>2</numero_cançons>
        <titols_cançons>
            <canço numero="1">
                <titol_canço>So What</titol_canço>
                <durada_canço>9:22</durada_canço>
            </canço>
            <canço numero="2">
                <titol_canço>Freddie Freeloader</titol_canço>
                <durada_canço>9:46</durada_canço>
            </canço>
        </titols_cançons>
    </album>
</cataleg>
